{
  "$schema": "https://json-schema.org/draft/2020-12/schema",
  "$id": "https://compliance.example/schemas/policy/requirement-baseline-v1alpha1.schema.json",
  "title": "Compliance requirement baseline",
  "type": "object",
  "required": [
    "apiVersion",
    "kind",
    "metadata",
    "spec"
  ],
  "additionalProperties": false,
  "properties": {
    "apiVersion": {
      "const": "compliance.example/v1alpha1"
    },
    "kind": {
      "const": "RequirementBaseline"
    },
    "metadata": {
      "type": "object",
      "required": [
        "id",
        "revision"
      ],
      "additionalProperties": false,
      "properties": {
        "id": {
          "$ref": "#/$defs/identifier"
        },
        "revision": {
          "$ref": "#/$defs/revision"
        },
        "origin": {
          "type": "object",
          "required": [
            "type",
            "name"
          ],
          "additionalProperties": true,
          "properties": {
            "type": {
              "type": "string",
              "minLength": 1
            },
            "name": {
              "type": "string",
              "minLength": 1
            }
          }
        }
      }
    },
    "spec": {
      "type": "object",
      "required": [
        "title",
        "requirements"
      ],
      "additionalProperties": false,
      "properties": {
        "title": {
          "type": "string",
          "pattern": ".*\\S.*"
        },
        "requirements": {
          "type": "array",
          "minItems": 1,
          "items": {
            "$ref": "#/$defs/requirementPin"
          }
        },
        "extends": {
          "type": "object",
          "additionalProperties": false,
          "properties": {
            "baseline": {
              "type": "string",
              "minLength": 1
            },
            "digest": {
              "type": "string",
              "pattern": "^sha256:[0-9a-f]{64}$"
            }
          },
          "required": [
            "baseline",
            "digest"
          ]
        },
        "parameter_operations": {
          "type": "array",
          "items": {
            "type": "object",
            "additionalProperties": false,
            "properties": {
              "id": {
                "type": "string",
                "minLength": 1
              },
              "op": {
                "enum": [
                  "bind",
                  "tailor",
                  "seal"
                ]
              },
              "target": {
                "type": "object",
                "additionalProperties": false,
                "properties": {
                  "requirement": {
                    "type": "string",
                    "minLength": 1
                  },
                  "digest": {
                    "type": "string",
                    "pattern": "^sha256:[0-9a-f]{64}$"
                  },
                  "slot": {
                    "type": "string",
                    "minLength": 1
                  },
                  "declaration_digest": {
                    "type": "string",
                    "pattern": "^sha256:[0-9a-f]{64}$"
                  },
                  "schema_digest": {
                    "type": "string",
                    "pattern": "^sha256:[0-9a-f]{64}$"
                  }
                },
                "required": [
                  "requirement",
                  "digest",
                  "slot",
                  "declaration_digest",
                  "schema_digest"
                ]
              },
              "expected_parent_fingerprint": {
                "type": "string",
                "pattern": "^sha256:[0-9a-f]{64}$"
              },
              "from": {},
              "to": {},
              "deviation": {
                "type": "object",
                "required": [
                  "id",
                  "classification",
                  "rationale",
                  "approval_ref",
                  "review_after"
                ],
                "additionalProperties": false,
                "properties": {
                  "id": {
                    "type": "string",
                    "minLength": 1
                  },
                  "classification": {
                    "type": "string",
                    "minLength": 1
                  },
                  "rationale": {
                    "type": "string",
                    "minLength": 1
                  },
                  "approval_ref": {
                    "type": "string",
                    "minLength": 1
                  },
                  "review_after": {
                    "type": "string",
                    "format": "date"
                  }
                }
              }
            },
            "required": [
              "id",
              "op",
              "target",
              "expected_parent_fingerprint"
            ],
            "allOf": [
              {
                "if": {
                  "properties": {
                    "op": {
                      "const": "bind"
                    }
                  }
                },
                "then": {
                  "required": [
                    "to"
                  ],
                  "not": {
                    "anyOf": [
                      {
                        "required": [
                          "from"
                        ]
                      },
                      {
                        "required": [
                          "deviation"
                        ]
                      }
                    ]
                  }
                }
              },
              {
                "if": {
                  "properties": {
                    "op": {
                      "const": "tailor"
                    }
                  }
                },
                "then": {
                  "required": [
                    "from",
                    "to",
                    "deviation"
                  ]
                }
              },
              {
                "if": {
                  "properties": {
                    "op": {
                      "const": "seal"
                    }
                  }
                },
                "then": {
                  "not": {
                    "anyOf": [
                      {
                        "required": [
                          "from"
                        ]
                      },
                      {
                        "required": [
                          "to"
                        ]
                      },
                      {
                        "required": [
                          "deviation"
                        ]
                      }
                    ]
                  }
                }
              }
            ]
          }
        }
      }
    }
  },
  "$defs": {
    "identifier": {
      "type": "string",
      "minLength": 1,
      "pattern": "^[a-z0-9][a-z0-9._-]*$"
    },
    "revision": {
      "oneOf": [
        {
          "type": "integer",
          "minimum": 1
        },
        {
          "type": "string",
          "minLength": 1
        }
      ]
    },
    "digest": {
      "type": "string",
      "pattern": "^sha256:[0-9a-f]{64}$"
    },
    "requirementPin": {
      "type": "object",
      "required": [
        "requirement",
        "digest",
        "required"
      ],
      "additionalProperties": false,
      "properties": {
        "requirement": {
          "type": "string",
          "minLength": 3,
          "pattern": "^.+@.+$"
        },
        "digest": {
          "$ref": "#/$defs/digest"
        },
        "required": {
          "const": true
        }
      }
    }
  }
}
