{
  "apiVersion": "compliance.example/v1alpha1",
  "kind": "RequirementBaseline",
  "metadata": {
    "id": "alder-forge.programme.assurance",
    "revision": 1,
    "origin": {"type": "alder-forge-programme-policy", "name": "Alder Forge bounded organisational assurance Objectives"}
  },
  "spec": {
    "title": "Alder Forge bounded organisational assurance Objectives",
    "requirements": [
      {"requirement": "alder-forge.authorized-software-review@1", "digest": "sha256:658de2f55ed8d44ac3c518df13b335917c2ae9b20cf2177faa37c2a05fdaa181", "required": true},
      {"requirement": "alder-forge.awareness-training@1", "digest": "sha256:84fc054e492e04bd115b002037a40759cd6775fa6a8670f8a25b7995280bd186", "required": true},
      {"requirement": "alder-forge.certification.ce-plus-scope@1", "digest": "sha256:3762d95ef6b942107fcd19ff2065d80ee9066e870b6f0fc20e5710a1d51d58ef", "required": true},
      {"requirement": "alder-forge.periodic-risk-assessment@1", "digest": "sha256:f4441ea9df00ce5f22ba35701cd2b3e143c5b248c6b486569521b7cb573d9223", "required": true}
    ]
  }
}
