{
  "apiVersion": "compliance.example/v1alpha1",
  "kind": "RequirementBaseline",
  "metadata": {
    "id": "company.authorized-software-base",
    "revision": 1
  },
  "spec": {
    "title": "Synthetic base authorized software",
    "requirements": [
      {
        "requirement": "company.authorized-software@1",
        "digest": "sha256:b69d0692d6721011c5b60526c47f15e9fe19ad971ba0cd12150b70f5fff00cbb",
        "required": true
      }
    ],
    "parameter_operations": [
      {
        "id": "bind-allowed-software",
        "op": "bind",
        "target": {
          "requirement": "company.authorized-software@1",
          "digest": "sha256:b69d0692d6721011c5b60526c47f15e9fe19ad971ba0cd12150b70f5fff00cbb",
          "slot": "allowed_software",
          "declaration_digest": "sha256:c20565ab79bc904cfe206770f81b8521e9860c667a408fcd6014ab8574dc0875",
          "schema_digest": "sha256:97dc85e04e624b64e9962bc7e9387080bef130447a415c491d05b9370a961f94"
        },
        "expected_parent_fingerprint": "sha256:d6347fb69c550860fb0564b29144f3135da90dbe245c099887731478d0dbc0a2",
        "to": [
          "auditd",
          "curl"
        ]
      }
    ]
  }
}
