{
  "apiVersion": "compliance.example/v1alpha1",
  "kind": "RequirementBaseline",
  "metadata": {"id": "alder-forge.critical-access-mfa", "revision": 1},
  "spec": {
    "title": "Alder Forge critical access MFA objective",
    "requirements": [
      {"requirement": "alder-forge.critical-access.mfa@1", "digest": "sha256:4ec573c59dde2183a4fa35650f71015d503bba4402cdcd38be1521a6440fc5ab", "required": true}
    ]
  }
}
