{
  "apiVersion": "compliance.example/v1alpha1",
  "kind": "RequirementBaseline",
  "metadata": {"id": "alder-forge.board-security-direction", "revision": 1},
  "spec": {
    "title": "Alder Forge board security direction objective",
    "requirements": [
      {"requirement": "alder-forge.board-security-direction@1", "digest": "sha256:64532eb617835f5876ce54ab93d384b6bf1791fedd189d3b873b6d41a5d9d38a", "required": true}
    ]
  }
}
